"region","subregion","country","srap","iif_established","plan","planned_other_voluntary_national_target","iso3","terr_name","lat","lon","iso2","description"
"Asia","Central Asia","Kyrgyzstan",false,false,"2016_2017",null,"KGZ","Kyrgyzstan","41.465055","74.555597","KG","Within the framework of the GEF/UNDP/GM/GIZ multi-country project Capacity Building for SLM (2010-2012), the key provisions of Integrated Financial Strategy (IFS) were developed, coordinated and supported by Global Mechanism, UNDP and GIZ and involving all the target groups at the national level. The IFS strategic goals are to: (i) create favorable conditions for resource mobilization; (ii) enhance effective mobilization and allocation of domestic resources; (iii) improve engagement of external resources; (iv) broaden the scope of innovative resource mobilization. It is intended that the IFS will become part of the NAP and its implementation, involving all the stakeholders and considerably increasing the updated NAP’s financial and technical ability to combat desertification and drought in Kyrgyzstan."
"Asia","Central Asia","Tajikistan",false,false,"2018_2019",null,"TJK","Tajikistan","38.860256","71.350363","TJ","As part of the multi-GEF / UNDP / GM / GIZ CACILM ""Capacity building for SLM"" (2010-2012) developed the basic provisions of the Integrated Financing Strategy (IFS) for coordination and support of the Global Mechanism, UNDP and GIZ, with the participation of all target groups at national level. Strategic objectives NIF: (i) creating an enabling environment for resource mobilization; (ii) improving the efficiency of resource mobilization and allocation of domestic resources; (iii) expansion of outsourcing, (iv) expansion of innovative mobilization of resources. It is planned that the NIF will be part of the NAP and its implementation with the participation of all stakeholders will significantly expand the financial and technical capabilities of the updated NAP to combat desertification and drought in Kazakhstan."
"Asia","Central Asia","Turkmenistan",false,false,"no_plan",null,"TKM","Turkmenistan","39.122335","59.383984","TM","A comprehensive investment system was developed in 2011-2012 as part of the CAСILM project, but this program never had any practical application. "
"Asia","Central Asia","Uzbekistan",false,false,"2016_2017",null,"UZB","Uzbekistan","41.750444","63.169364","UZ","1. As part of the multi-country CACILM project ""Capacity Building for SLM"" (2010 -2012.) the draft Integrated Financing Strategy (IFS) has been prepared in coordination with financial and technical support from GEF, the Global Mechanism, UNDP and GIZ.2.Strategic objective of the IFS is follows: (a) creating an enabling environment for resource mobilization; (b) enhancing the mobilization and allocation of internal resources; (c) raising external sources of financing; (d) mobilizing innovative resources.Planned that IFS will be part of the NAP and its implementation significantly expand financial and technical capacity to achieve expected outputs of the updated NAP to combat desertification and drought in Uzbekistan."
"Asia","Central Asia","The Regional Environmental Centre for Central Asia (CAREC) Subregional Action Programme","true",false,"no_plan",null,,,,,,null
"Asia","East Asia","China",false,true,"plan_exists",null,"CHN","China","36.567909","103.904056","CN","The IIF in China is established based on the master plan on combating desertification and relevant sectors plan and policy, which has been implemented basically, including 1. Key program based public fiscal input from central governmental and provincial governmental for ecological improvement, 2.Ecological benefits compensation payment for public welfare ecological forest and forestry subsidies from central and local government fiscal,3. Grassland conservation and sustainable use awarding and subsidy from central and local governments,4.Central governmental payment to farmers for conversion of degraded land to forest,5.Development confessional loan from national development Bank and bank of agriculture 6.Business investment from private sectors and individuals encouraged by taxations exemption and interest free credit policy,7. Fee and compensation payment for land rehabilitation from mining, industry companies or public infrastructure projects,,8.Cross region ecological or water conservation payment from government,9. Co-financing for water and soil conservation and sand dune stabilization from Infrastructure construction programs,10.Donation from private sectors, individuals, NGOs and CSOs, 11.Bilateral and multilateral governmental cooperation, 12.Donation from international NGOs.IIF establishment in China is a long term process which based mainly on the practices and  experiences in the course of long term efforts in anti-desertification both from domestic projects and various project and cooperation with many partners ."
"Asia","East Asia","Mongolia",false,false,"no_plan",null,"MNG","Mongolia","46.835291","103.083218","MN","Joint project with Swiss Development Agency(SDC)-""Coping with Desertification""Joint project with Royal Dutch Government, Swiss Development Agency and UNDP -""Sustainable Land Management for Combating Desertification""Joint project with the Government of Republic of Korea -""Green belt""Joint project with SDC - ""Green Gold"""
"Asia","East Asia","Republic of Korea",false,false,"no_plan",null,"KOR","Korea, Republic of","36.375089","127.834772","KR",null
"Asia","East Asia","Network for Mitigation of Desertification, Land Degradation and Drought Subregional Action Programme (DLDDNEAN)","true",false,"no_plan",null,,,,,,null
"Asia","Pacific","Cook Islands",false,false,"no_plan",null,"COK","Cook Islands","-20.934038","-158.908883","CK",null
"Asia","Pacific","Fiji",false,true,"plan_exists",null,"FJI","Fiji","-17.45353","171.983227","FJ","The IFF mainly focus on the Agriculture Sector Development Strategy which is also based on NAP. It provided the framework which guides the activities in the ministry such as: Improve Sustainable Resource Management, Productivity & output, Policy advice & Legislative enactment and stakeholders partnership"
"Asia","Pacific","Kiribati",false,false,"2016_2017",null,"KIR","Kiribati","1.834562","-154.458271","KI",null
"Asia","Pacific","Micronesia (Federated States of)",false,false,"no_plan",null,"FSM","Micronesia (Federated States of)","6.49238","159.404221","FM",null
"Asia","Pacific","Nauru",false,false,"no_plan","Subject to NAP IFS completion and availability of NAP Alignment funds.","NRU","Nauru","-0.528742","166.92313","NR",null
"Asia","Pacific","Niue",false,false,"2016_2017",null,"NIU","Niue","-19.05231","-169.868781","NU",null
"Asia","Pacific","Palau",false,true,"plan_exists",null,"PLW","Palau","7.501882","134.568687","PW","Green Fee for PAN and sewer system improvement; MC Endowment; efforts towards accreditation to be an NIE (National Implementing Entity), SLM Finance Strategy"
"Asia","Pacific","Samoa",false,false,"2016_2017",null,"WSM","Samoa","-13.758364","-172.159464","WS","A feasibility study to identify the potentials and challenges for the development of Integrated Investment Frameworks for SLMs in Samoa and Fiji was conducted in 2012. The results indicated key options for IIF in the two countries including the REDD and Trust Funds for mobilizing long term financing that would effectively support LDD initiatives in the countries in synergy with climate change and biodiversity conservation and sustainable use objectives. The study was funded by the UNCCD Global Mechanism (GM) and implemented by the Secretariat of the Pacific Regional Environment Programme (SPREP) in collaboration with the Government of Fiji (GoF) and the Government of Samoa (GoS)."
"Asia","Pacific","Solomon Islands",false,false,"no_plan",null,"SLB","Solomon Islands","-8.918214","159.634315","SB","At this stage there is no specific IIF in place for DLDD however the current government through its Ministry of  Planning and Aid Coordination are developing a similar framework to manage and monitor International Donor fundings as well as a policy document to support and enhance its implementation. The reform the government is taking in terms of Aid money monitoring will set a perfect scene to developing a IIF for DLDD."
"Asia","Pacific","Tonga",false,false,"2018_2019",null,"TON","Tonga","-20.40292","-174.836286","TO",null
"Asia","Pacific","Tuvalu",false,false,"no_plan",null,"TUV","Tuvalu","-7.827722","178.557551","TV","Grants were directly recieved from the UNCCD secretariat to implement SLM project activities, Finance Department is not aware if there are other funding mechanisms from other sources that have been received for further DLDD activities "
"Asia","Pacific","Vanuatu",false,false,"no_plan",null,"VUT","Vanuatu","-16.255053","167.718146","VU",null
"Asia","South Asia","Bangladesh",false,false,"no_plan",null,"BGD","Bangladesh","23.843232","90.268498","BD","Bangladesh has partial investment framework. Full IIF is very much necessary."
"Asia","South Asia","Bhutan",false,true,"plan_exists",null,"BTN","Bhutan","27.415414","90.429435","BT","Annual plans are prepared based on the National Five Year Plan documents which are formulated and endorsed by the parliament. The plan is inclusive of both government and Donor funds. "
"Asia","South Asia","India",false,true,"plan_exists",null,"IND","India","22.326122","79.386009","IN","IIF shall be based on the Aligned National Action Programme (NAP), which is under preparation. The financial assistance for this purpose has been received from GEF under the project ""Enhancing Capacity for Alignment of National Action programme to 10 year Strategy of UNCCD and for National Reporting to UNCCD Secretariat (TF 12765)"". "
"Asia","South Asia","Nepal",false,false,"2016_2017",null,"NPL","Nepal","28.253007","83.938548","NP",null
"Asia","South Asia","Pakistan",false,false,"2014_2015",null,"PAK","Pakistan","29.357903","68.790144","PK","Integrated Investment Framework (IIF) for implementation of aligned NAP and SLM programme is an essential instrument for enhancing investments to meet challenges of DLDD. IIF will have the potential to develop capacity of policy makers, planners and SLM professionals for the effective financial planning both at the federal and provincial levels for promoting SLM in Pakistan.An approved GEF funded Enabling Activity project on Integrated Financial Strategy (IFS) have provisions to develop an integrated investment framework for Pakistan in next biannual reporting cycle to ensure sustainable investment for SLM activities. In this regard mapping of current financing arrangements will be reviewed to identify funding requirements, gaps and opportunities for diverse financing sources. As part of this process, an economic analysis of LD will also be carried out. This component of project will be funded by the Global Mechanism (GM) of the UNCCD."
"Asia","South Asia","Sri Lanka",false,true,"plan_exists",null,"LKA","Sri Lanka","7.608086","80.704727","LK","Preparation of Integrated Investment Framework (IFS) was just completed "
"Asia","South East Asia","Cambodia",false,true,"plan_exists",null,"KHM","Cambodia","12.716432","104.923981","KH","The IIF is based on the NAP and prepared with assistance from GM and Norway."
"Asia","South East Asia","Indonesia",false,false,"no_plan",null,"IDN","Indonesia","-2.230214","117.300428","ID","Investment framework on combating land degradation in Indonesia refers to sectoral strategic plan so far"
"Asia","South East Asia","Lao People's Democratic Republic",false,false,"2014_2015",null,"LAO","Lao People's Democratic Republic","18.502744","103.763291","LA","The IFS could be a next step as an activity in Laos, now that the enabling policy and capacity framework has been built in Laos supported by The Global Mechanism of the UNCCD and the EU."
"Asia","South East Asia","Malaysia",false,false,"no_plan",null,"MYS","Malaysia","3.792367","109.708194","MY","Malaysia hopes to request the assistance of the GM Secretariat to develop the IIF in the near future."
"Asia","South East Asia","Myanmar",false,true,"plan_exists",null,"MMR","Myanmar","21.154319","96.506921","MM","Integrated Financing Strategy (IFS) for Sustainable Land Management (SLM) in Myanmar, assisted by GM-UNCCD, draft completed in March 2013"
"Asia","South East Asia","Philippines",false,false,"2014_2015",null,"PHL","Philippines","11.741833","122.878708","PH","The Philippines has not yet received assistance from the GM particularly in terms of the needed training on the development of IIF/IFS. There is a need to organize relevant training for affected countries to formulate the IIF for the PNAP."
"Asia","South East Asia","Singapore",false,false,"no_plan",null,"SGP","Singapore","1.351615","103.808051","SG","`"
"Asia","South East Asia","Thailand",false,false,"no_plan",null,"THA","Thailand","15.127036","101.017361","TH",null
"Asia","South East Asia","Timor-Leste",false,false,"no_plan",null,"TLS","Timor-Leste","-8.822976","125.853675","TL",null
"Asia","South East Asia","Viet Nam",false,true,"plan_exists",null,"VNM","Vietnam","14.287268","108.341384","VN","The NAP established in 2006, but it does not included mechanisms such as IFS. However, Viet Nam has implemented successfully IFS piloting in Ninh Thuan and Binh Thuan provinces and the major results have been achieved so far as the integrated actions plan to combat desertification of provinces to mobilize financial resource for DLDD."
"Asia","West Asia","Iran (Islamic Republic of)",false,false,"2018_2019",null,"IRN","Iran (Islamic Republic of)","32.565771","54.301402","IR","So far, we have not yet aligned NAP including IIF and IFS. Regarding the assistance, just GM organized a workshop for Integrated Financing Strategy and we did not receive any other assistance."
"Asia","West Asia","Iraq",false,false,"no_plan",null,"IRQ","Iraq","33.048024","43.772135","IQ","The Integrated Investment Framework (IIF) is not available yet, as defined by UNCCD. The IIF future development depends on providing financial and technical support by the specialized entities and organizations. This does not mean that the Iraqi government does not invest in the field of desertification, land degradation and drought (DLDD). The financial requirements and priority projects are usually listed in the plans and budgets of the relevant ministries and are included in the framework of the Iraq development five-year plans. There are pilot initiatives and projects, including but not limited to, the agricultural initiative, the oases, pastures and dunes stabilization project. It is necessary to detail the agricultural initiative given its importance in combating desertification, realizing land reclamation and poverty mitigation. \n\nThe Iraqi government agricultural initiative is a pure national initiative; the Iraqi government did not receive any support from any other sub-regional, regional or international body. An amount of  500 million US Dollars (USD 500,000,000) has been allocated annually for the funding of this initiative: \n• The prime minister has launched this initiative for the agricultural sector development in the second half of the year 2007; \n• This initiative came to seriously contribute to the quick realization of the  sustainable agriculture through the following: \n1- Reforming the agricultural reality; \n2- Realizing the industrial agricultural integration; \n3- Supporting the efforts of the Ministry of Water Resources in its agricultural supporting work and water use rationalization; \n4- Supporting the efforts of the Ministry of Agriculture to develop and promote this sector; and \n5- Providing the cash liquidity necessary for the private sector through specialized lending funds, aiming to develop and invest in agricultural or industrial integrated projects. \n\nAgricultural Initiative Goals: \nThe most important goals of the agricultural initiative is to work towards the realization of food security through the following: \n• Selecting targeted developmental projects of clear tangible impact in both the Ministry of Agriculture and the Ministry of Water Resources to be financed from the amounts allocated to the agricultural initiative for their timely implementation; \n• Stopping the agricultural sector deterioration; \n• Enhancing the efficiency of the natural resources usage and enhancing the efficiency of the agricultural production; \n• Contributing in mitigating the unemployment ratio and contributing in reducing poverty; \n• Establishing a scientific fact-based national agricultural policy; \n• Rationalizing water use; \n• Stopping the water quality deterioration; \n• Increasing the agricultural production and increasing the food sufficiency ratio; and\n• Enhancing the scientific and professional level of the cadres working in the agricultural sector. \n\nAgricultural Initiative Financial Allocations: \n• An amount of 500 million US Dollars (Equivalent to 600 billion Iraqi Dinars) is allocated annually for the agricultural initiative to be distributed in addition to the allocations made by the Ministry of Water Resources, the Ministry of Agriculture and the Agricultural Cooperative Bank of Iraq in their investment methodologies, as follows: \n1- One Hundred and Eighty Eight Million US Dollars (USD 188,000,000): for the implementation of additional projects by the Ministry of Water Resources amounting to (9) important projects that realize the agricultural initiative goals; \n2- Seventy Million US Dollars (USD 70,000,000): for the implementation of additional projects by the Ministry of Agriculture amounting to (24) projects; and\n3- Two Hundred and Forty Million US Dollars (USD 240,000,000): for the specialized lending funds. \n• Total allocations as of 2008 amounted to almost 3 billion US Dollars (USD 3,000,000,000); \n• The Higher Committee for the Agricultural Initiative supported the agricultural education through: \n1- Providing scholarships for post-graduate certificates in the agricultural sector amounting to 130 scholarships to Australia; \n2- Supporting the vocational agricultural education in the Ministry of Education with almost One billion Dinars for the purchasing of educational agricultural equipment and machines; \n3- Supporting and funding the agricultural sector-related scientific conferences; and \n4- Printing a set of agricultural sector-related books. \n\nThe Agricultural Initiative Specialized Lending Funds and Their Role: \n• Enhancing the private sector role and enhancing its capabilities for the development of the agricultural sector; \n• Creating a strong base for the agricultural development without burdening the state’s budgets; \n• Developing peasants and farmers’ capabilities; \n• Effectively participating in the rural development and poverty mitigation works; \n• Providing job opportunities for the agricultural and veterinary unemployed graduates and rural residents aiming to reduce the disguised unemployment amongst the rural families. \n\nIraqi Government Agricultural Loan Funding Sources: \n• The amounts allocated to the Agricultural Initiative Specialized Funds amounted to a total of 1,600 Billion Dinars throughout the past six years; \n• The self resource amounts of the Agricultural Cooperative Bank since 2010 amounted to a total of 300 billion Iraqi Dinars; \n• The amounts allocated to the Small Farmers Fund in the Ministry of Agriculture amounted to 54 billion Iraqi Dinars; and \n• The mounts allocated to the Mesopotamian Marshes Lending Fund amounted to 5 billion Iraqi Dinars. \n\nThis multiple funding provides flexibility to cover all agricultural purposes towards the agricultural development realization in Iraq. \n\nThe amounts allocated for the Agricultural initiative specialized funds are the biggest in terms of allocation and are the easiest and least complex in terms of payment to farmers, not only in Iraq but in all the countries of the region. \n\nThe agricultural initiatives of the Iraqi government participated in doing the following: \n• Establishing and re-operating 100,860 agricultural projects for agricultural and animal production supporting the agricultural production; \n• Operating about 1.5 million laborers; \n• Increasing the agricultural production during the period 2007 – 2013 represented as follows: \n• Growth in the wheat production by 73.2% at an annual growth rate of 12.2%; and \n• Growth in the barley production by 85.6% at an annual growth rate of 14.3%. "
"Asia","West Asia","Jordan",false,true,"plan_exists",null,"JOR","Jordan","31.312616","36.288613","JO","IFS was based on the NAP; The IFS was reviewed late 2013 "
"Asia","West Asia","Kuwait",false,false,"2014_2015",null,"KWT","Kuwait","29.340791","47.590876","KW",null
"Asia","West Asia","Lebanon",false,false,"2014_2015",null,"LBN","Lebanon","33.920267","35.888027","LB",null
"Asia","West Asia","Oman",false,false,"2014_2015",null,"OMN","Oman","20.099577","56.609501","OM",null
"Asia","West Asia","Qatar",false,false,"2016_2017",null,"QAT","Qatar","25.297876","51.188069","QA",null
"Asia","West Asia","Saudi Arabia",false,false,"no_plan",null,"SAU","Saudi Arabia","24.122888","44.545719","SA",null
"Asia","West Asia","Syrian Arab Republic",false,false,"2016_2017",null,"SYR","Syrian Arab Republic","35.013134","38.505132","SY","An IIF was not developed due to non-access to the funding needed for the national plan to combat desertification with the UNCD as a result of the donors’ policy towards the Syrian Arab Republic. "
"Asia","West Asia","United Arab Emirates",false,false,"2014_2015",null,"ARE","United Arab Emirates","23.903193","54.340734","AE",null
"Asia","West Asia","Yemen",false,false,"2014_2015",null,"YEM","Yemen","15.905517","47.599591","YE",null
"Central and Eastern Europe","Central and Eastern Europe","Armenia",false,false,"no_plan",null,"ARM","Armenia","40.28662","44.946824","AM",null
"Central and Eastern Europe","Central and Eastern Europe","Azerbaijan",false,false,"no_plan",null,"AZE","Azerbaijan","40.292173","47.532767","AZ",null
"Central and Eastern Europe","Central and Eastern Europe","Belarus",false,false,"2014_2015",null,"BLR","Belarus","53.539998","28.046788","BY",null
"Central and Eastern Europe","Central and Eastern Europe","Bosnia and Herzegovina",false,false,"no_plan",null,"BIH","Bosnia-Herzegovina","44.168115","17.786531","BA",null
"Central and Eastern Europe","Central and Eastern Europe","Bulgaria",false,false,"no_plan",null,"BGR","Bulgaria","42.761377","25.231506","BG","1. For the period 2009–2013, the funding of the activities was implemented mainly under Operational Programme „Environment“. The specific objectives are: Preservation and improvement of the state of water; Enhancing the waste management and the soil protection; Preservation of the biodiversity and environmental protection. The implementation of the said objectives will lead to improving the quality of life of the population in the country and increasing the possibilities to invest in its economy. The overall financial envelope for the implementation of Operational Programme “Environment 2007 - 2013” amounts to Euro 1 800 748 087. Under Priority axis 2 in the Waste Management and the soil protection sector, the co-financing is provided by the European Regional Development Fund and amounts to Euro 311 732 038. The national co-financing is Euro 55 011 536, which comes to a total amount of the funds intended for the implementation of the activities in the sector, Euro 366.74 mln. 2. An Enterprise for the Management of Environmental Protection Activities is established at the Ministry of Environment and Water. The enterprise provides free financial aid to environmental projects of municipalities under qualification requirements publicly announced on its website and grants loans for financing environmental projects and activities of municipalities, physical persons and legal entities under qualification requirements publically announced on its website. EMEPA provided financing to non-investment projects and activities, enabling the implementation of the environmental protection and restoration policy of the Ministry of Environment and Water. It finances: •  Waste Management Projects; •  Projects for construction of waste water treatment plants and sewage networks ; • Projects related  to construction and reconstruction of small water supply pipelines and facilities of local importance for potable water supply of the population; • Projects in the field of the protection of ambient air; • Projects related to organic farming, environmentally sound livestock breeding and ecotourism; • Biodiversity projects; • Rules for granting loans by the Enterprise for the Management of Environmental Protection Activities.• Technical Assistance for preparation of investment projects for funding the Operational Programme „Environment 2007-2013” The funds are released in the form of:     - Grants;    - Interest-free loans. "
"Central and Eastern Europe","Central and Eastern Europe","Georgia",false,false,"2016_2017",null,"GEO","Georgia","42.176312","43.517446","GE",null
"Central and Eastern Europe","Central and Eastern Europe","Latvia",false,false,"2016_2017",null,"LVA","Latvia","56.857534","24.929424","LV","Over the reporting period, funding from Global Environment Facility (GEF) was not received and used. The farmers can apply for single-area payments if they keep agricultural land in good agricultural and environmental conditions. These payments are paid from European Union funding and state budget."
"Central and Eastern Europe","Central and Eastern Europe","Montenegro",false,false,"2014_2015",null,"MNE","Montenegro","42.791593","19.250305",,"Montenegro is currently aligning its NAP with the UNCCD 10-year Strategy and IFS will be developed as its integral component. "
